{
  "contractVersion": "1.1",
  "messageId": "msg-example-both-1",
  "correlationId": "11111111-1111-1111-1111-111111111113",
  "satelliteId": "segsense",
  "satelliteRole": "EXPERIENCE",
  "interactionType": "REQUEST_DECISION",
  "createdAt": "2026-09-14T15:03:00Z",
  "idempotencyKey": "idem-example-both-1",
  "purpose": "INSURANCE_PROTECTION_ASSESSMENT",
  "objective": {
    "text": "COMPARE_COVERAGE_GAPS",
    "origin": "USER_DECLARED",
    "declaredAt": "2026-09-14T15:03:04Z"
  },
  "context": {
    "snapshot": {
      "schemaVersion": "1.1",
      "classification": "INTERNAL",
      "nonPersonal": true,
      "selectedContribution": "BOTH",
      "provenance": {
        "sourceType": "USER_DECLARED",
        "sourceId": "SEGSENSE_DECLARED_FAMILY_CONTINUITY_V1",
        "sourceTimestamp": "2026-09-14T15:03:00Z",
        "captureMethod": "SATELLITE_DECLARED",
        "trustLevel": "DECLARED"
      },
      "contributions": [
        {
          "role": "GOVERNED_SOURCE",
          "sourceType": "SATELLITE_GOVERNED",
          "sourceId": "SEGSENSE_FAMILY_CONTINUITY_SYNTHETIC_V1",
          "sourceTimestamp": "2026-09-13T12:00:00Z",
          "captureMethod": "SERVER_REGISTRY",
          "trustLevel": "GOVERNED",
          "used": true,
          "elements": {
            "theme": "family_continuity",
            "situation": "dependents_need_continuity",
            "need": "understand_options",
            "horizon": "years",
            "constraint": "no_quote"
          }
        },
        {
          "role": "VISITOR_DECLARED",
          "sourceType": "USER_DECLARED",
          "sourceId": "SEGSENSE_DECLARED_FAMILY_CONTINUITY_V1",
          "sourceTimestamp": "2026-09-14T15:03:00Z",
          "captureMethod": "SATELLITE_DECLARED",
          "trustLevel": "DECLARED",
          "used": true,
          "elements": { "theme": "family_continuity" }
        }
      ],
      "attributes": {
        "channel": "SEGSENSE_PUBLIC_DEMO",
        "purposeVersion": "demo-purpose-v1",
        "theme": "family_continuity",
        "constraint": "no_quote"
      }
    }
  },
  "dataClassification": "INTERNAL",
  "responseChannel": "SYNC",
  "metadata": {}
}
